{
  "$schema": "http://json-schema.org/draft-07/schema#",
  "type": "object",
  "properties": {
    "schemaVersion": {
      "type": "number",
      "const": 1
    },
    "id": {
      "type": "string",
      "format": "uuid",
      "pattern": "^([0-9a-fA-F]{8}-[0-9a-fA-F]{4}-[1-8][0-9a-fA-F]{3}-[89abAB][0-9a-fA-F]{3}-[0-9a-fA-F]{12}|00000000-0000-0000-0000-000000000000|ffffffff-ffff-ffff-ffff-ffffffffffff)$"
    },
    "changeSetId": {
      "type": "string",
      "format": "uuid",
      "pattern": "^([0-9a-fA-F]{8}-[0-9a-fA-F]{4}-[1-8][0-9a-fA-F]{3}-[89abAB][0-9a-fA-F]{3}-[0-9a-fA-F]{12}|00000000-0000-0000-0000-000000000000|ffffffff-ffff-ffff-ffff-ffffffffffff)$"
    },
    "createdAt": {
      "type": "string",
      "format": "date-time",
      "pattern": "^(?:(?:\\d\\d[2468][048]|\\d\\d[13579][26]|\\d\\d0[48]|[02468][048]00|[13579][26]00)-02-29|\\d{4}-(?:(?:0[13578]|1[02])-(?:0[1-9]|[12]\\d|3[01])|(?:0[469]|11)-(?:0[1-9]|[12]\\d|30)|(?:02)-(?:0[1-9]|1\\d|2[0-8])))T(?:(?:[01]\\d|2[0-3]):[0-5]\\d(?::[0-5]\\d(?:\\.\\d+)?)?(?:Z))$"
    },
    "sections": {
      "type": "object",
      "properties": {
        "scope": {
          "type": "string",
          "minLength": 1
        },
        "non-goals": {
          "type": "string",
          "minLength": 1
        },
        "audience": {
          "type": "string",
          "minLength": 1
        },
        "compatibility": {
          "type": "string",
          "minLength": 1
        },
        "security": {
          "type": "string",
          "minLength": 1
        },
        "performance": {
          "type": "string",
          "minLength": 1
        },
        "observability": {
          "type": "string",
          "minLength": 1
        },
        "rollout": {
          "type": "string",
          "minLength": 1
        },
        "acceptance": {
          "type": "string",
          "minLength": 1
        }
      },
      "required": [
        "scope",
        "non-goals",
        "audience",
        "compatibility",
        "security",
        "performance",
        "observability",
        "rollout",
        "acceptance"
      ],
      "additionalProperties": false
    },
    "requirementIds": {
      "type": "array",
      "items": {
        "type": "string",
        "format": "uuid",
        "pattern": "^([0-9a-fA-F]{8}-[0-9a-fA-F]{4}-[1-8][0-9a-fA-F]{3}-[89abAB][0-9a-fA-F]{3}-[0-9a-fA-F]{12}|00000000-0000-0000-0000-000000000000|ffffffff-ffff-ffff-ffff-ffffffffffff)$"
      }
    }
  },
  "required": [
    "schemaVersion",
    "id",
    "changeSetId",
    "createdAt",
    "sections",
    "requirementIds"
  ],
  "additionalProperties": false
}
